{
  "event_id": "77777777-7777-4777-8777-777777777777",
  "provider_id": "BANK_A",
  "scenario_run_id": "22222222-2222-4222-8222-222222222222",
  "sequence": 1,
  "event_type": "PAYMENT_ACCEPTED",
  "occurred_at": "2026-10-24T09:00:00Z",
  "transfer_reference": "SIM-TRF-1045",
  "order_reference": "ORD-1045",
  "payment_reference": "SIM-TRF-1045",
  "amount": {
    "minor_units": "250000",
    "currency": "ETB"
  },
  "payload_version": 1
}
